[
  {
    "feature_id": "PLAYER_CLASS_TEMP_AEDRIC_001",
    "system": "PLAYER",
    "category": "Class",
    "subcategory": "Aedric Spear",
    "feature_type": "ACTIVE",
    "name": "Puncturing Strikes",
    "parent_feature": null,
    "class_restriction": "Templar",
    "unlock_method": "Aedric Spear rank 1",
    "resource_type": "Stamina",
    "resource_cost": 2700,
    "cast_time": "Channeled",
    "target_type": "Area",
    "range_m": 7,
    "radius_m": null,
    "duration_sec": null,
    "cooldown_sec": null,
    "base_effect": "Channel a flurry of strikes dealing Physical Damage over 1 second. The final strike deals 300% increased damage. Enemies hit by the final strike are knocked back 4 meters.",
    "scaling_stat": "Weapon Damage",
    "max_ranks": 4,
    "rank_progression": "Increases damage per rank",
    "buff_debuff_granted": null,
    "synergy": null,
    "tags": "damage|aoe|channeled|melee|knockback",
    "dlc_required": "Base Game",
    "patch_updated": "U48",
    "source_url": "https://uesp.net/wiki/Online:Puncturing_Strikes"
  },
  {
    "feature_id": "PLAYER_CLASS_TEMP_AEDRIC_002",
    "system": "PLAYER",
    "category": "Class",
    "subcategory": "Aedric Spear",
    "feature_type": "MORPH_A",
    "name": "Biting Jabs",
    "parent_feature": "PLAYER_CLASS_TEMP_AEDRIC_001",
    "class_restriction": "Templar",
    "unlock_method": "Puncturing Strikes rank 4",
    "resource_type": "Stamina",
    "resource_cost": 2700,
    "cast_time": "Channeled",
    "target_type": "Area",
    "range_m": 7,
    "radius_m": null,
    "duration_sec": null,
    "cooldown_sec": null,
    "base_effect": "Channel a flurry of strikes dealing Physical Damage over 1 second. The final strike deals 300% increased damage and knocks back enemies 4 meters. Each hit increases your Critical Strike chance by 5% for 5 seconds, stacking up to 4 times.",
    "scaling_stat": "Weapon Damage",
    "max_ranks": 4,
    "rank_progression": "Increases damage per rank",
    "buff_debuff_granted": "Increased Critical Strike",
    "synergy": null,
    "tags": "damage|aoe|channeled|melee|knockback|crit|stacking",
    "dlc_required": "Base Game",
    "patch_updated": "U48",
    "source_url": "https://uesp.net/wiki/Online:Biting_Jabs"
  },
  {
    "feature_id": "PLAYER_CLASS_TEMP_AEDRIC_003",
    "system": "PLAYER",
    "category": "Class",
    "subcategory": "Aedric Spear",
    "feature_type": "MORPH_B",
    "name": "Puncturing Sweep",
    "parent_feature": "PLAYER_CLASS_TEMP_AEDRIC_001",
    "class_restriction": "Templar",
    "unlock_method": "Puncturing Strikes rank 4",
    "resource_type": "Stamina",
    "resource_cost": 2700,
    "cast_time": "Channeled",
    "target_type": "Area",
    "range_m": 7,
    "radius_m": null,
    "duration_sec": null,
    "cooldown_sec": null,
    "base_effect": "Channel a flurry of strikes dealing Physical Damage over 1 second. The final strike deals 300% increased damage and knocks back enemies 4 meters. Heals you for 40% of damage done.",
    "scaling_stat": "Weapon Damage",
    "max_ranks": 4,
    "rank_progression": "Increases damage per rank",
    "buff_debuff_granted": null,
    "synergy": null,
    "tags": "damage|aoe|channeled|melee|knockback|heal|self-sustain",
    "dlc_required": "Base Game",
    "patch_updated": "U48",
    "source_url": "https://uesp.net/wiki/Online:Puncturing_Sweep"
  },
  {
    "feature_id": "PLAYER_CLASS_TEMP_AEDRIC_004",
    "system": "PLAYER",
    "category": "Class",
    "subcategory": "Aedric Spear",
    "feature_type": "ACTIVE",
    "name": "Piercing Javelin",
    "parent_feature": null,
    "class_restriction": "Templar",
    "unlock_method": "Aedric Spear rank 4",
    "resource_type": "Stamina",
    "resource_cost": 2700,
    "cast_time": "Instant",
    "target_type": "Enemy",
    "range_m": 22,
    "radius_m": null,
    "duration_sec": null,
    "cooldown_sec": null,
    "base_effect": "Hurl a spear at an enemy dealing Physical Damage and knocking them back 6 meters, stunning them for 1.5 seconds.",
    "scaling_stat": "Weapon Damage",
    "max_ranks": 4,
    "rank_progression": "Increases damage per rank",
    "buff_debuff_granted": "Stun",
    "synergy": null,
    "tags": "damage|single-target|ranged|knockback|stun|cc",
    "dlc_required": "Base Game",
    "patch_updated": "U48",
    "source_url": "https://uesp.net/wiki/Online:Piercing_Javelin"
  },
  {
    "feature_id": "PLAYER_CLASS_TEMP_AEDRIC_005",
    "system": "PLAYER",
    "category": "Class",
    "subcategory": "Aedric Spear",
    "feature_type": "MORPH_A",
    "name": "Aurora Javelin",
    "parent_feature": "PLAYER_CLASS_TEMP_AEDRIC_004",
    "class_restriction": "Templar",
    "unlock_method": "Piercing Javelin rank 4",
    "resource_type": "Stamina",
    "resource_cost": 2700,
    "cast_time": "Instant",
    "target_type": "Enemy",
    "range_m": 28,
    "radius_m": null,
    "duration_sec": null,
    "cooldown_sec": null,
    "base_effect": "Hurl a spear at an enemy dealing Physical Damage and knocking them back 6 meters, stunning them for 1.5 seconds. Deals up to 40% more damage based on distance from target.",
    "scaling_stat": "Weapon Damage",
    "max_ranks": 4,
    "rank_progression": "Increases damage per rank",
    "buff_debuff_granted": "Stun",
    "synergy": null,
    "tags": "damage|single-target|ranged|knockback|stun|cc|execute",
    "dlc_required": "Base Game",
    "patch_updated": "U48",
    "source_url": "https://uesp.net/wiki/Online:Aurora_Javelin"
  },
  {
    "feature_id": "PLAYER_CLASS_TEMP_AEDRIC_006",
    "system": "PLAYER",
    "category": "Class",
    "subcategory": "Aedric Spear",
    "feature_type": "MORPH_B",
    "name": "Binding Javelin",
    "parent_feature": "PLAYER_CLASS_TEMP_AEDRIC_004",
    "class_restriction": "Templar",
    "unlock_method": "Piercing Javelin rank 4",
    "resource_type": "Stamina",
    "resource_cost": 2700,
    "cast_time": "Instant",
    "target_type": "Enemy",
    "range_m": 22,
    "radius_m": null,
    "duration_sec": null,
    "cooldown_sec": null,
    "base_effect": "Hurl a spear at an enemy dealing Physical Damage, stunning them for 2.5 seconds. Target does not get knocked back.",
    "scaling_stat": "Weapon Damage",
    "max_ranks": 4,
    "rank_progression": "Increases damage per rank",
    "buff_debuff_granted": "Stun",
    "synergy": null,
    "tags": "damage|single-target|ranged|stun|cc|immobilize",
    "dlc_required": "Base Game",
    "patch_updated": "U48",
    "source_url": "https://uesp.net/wiki/Online:Binding_Javelin"
  },
  {
    "feature_id": "PLAYER_CLASS_TEMP_AEDRIC_007",
    "system": "PLAYER",
    "category": "Class",
    "subcategory": "Aedric Spear",
    "feature_type": "ACTIVE",
    "name": "Focused Charge",
    "parent_feature": null,
    "class_restriction": "Templar",
    "unlock_method": "Aedric Spear rank 20",
    "resource_type": "Magicka",
    "resource_cost": 3240,
    "cast_time": "Instant",
    "target_type": "Enemy",
    "range_m": 22,
    "radius_m": null,
    "duration_sec": null,
    "cooldown_sec": null,
    "base_effect": "Charge with your divine lance to enemy, dealing Magic Damage. Interrupts the target if casting.",
    "scaling_stat": "Spell Damage",
    "max_ranks": 4,
    "rank_progression": "Increases damage per rank",
    "buff_debuff_granted": null,
    "synergy": null,
    "tags": "damage|single-target|gap-closer|interrupt",
    "dlc_required": "Base Game",
    "patch_updated": "U48",
    "source_url": "https://uesp.net/wiki/Online:Focused_Charge"
  },
  {
    "feature_id": "PLAYER_CLASS_TEMP_AEDRIC_008",
    "system": "PLAYER",
    "category": "Class",
    "subcategory": "Aedric Spear",
    "feature_type": "MORPH_A",
    "name": "Explosive Charge",
    "parent_feature": "PLAYER_CLASS_TEMP_AEDRIC_007",
    "class_restriction": "Templar",
    "unlock_method": "Focused Charge rank 4",
    "resource_type": "Magicka",
    "resource_cost": 3240,
    "cast_time": "Instant",
    "target_type": "Enemy",
    "range_m": 22,
    "radius_m": 6,
    "duration_sec": null,
    "cooldown_sec": null,
    "base_effect": "Charge with your divine lance to enemy, dealing Magic Damage to the target and nearby enemies. Interrupts the target if casting.",
    "scaling_stat": "Spell Damage",
    "max_ranks": 4,
    "rank_progression": "Increases damage per rank",
    "buff_debuff_granted": null,
    "synergy": null,
    "tags": "damage|aoe|gap-closer|interrupt",
    "dlc_required": "Base Game",
    "patch_updated": "U48",
    "source_url": "https://uesp.net/wiki/Online:Explosive_Charge"
  },
  {
    "feature_id": "PLAYER_CLASS_TEMP_AEDRIC_009",
    "system": "PLAYER",
    "category": "Class",
    "subcategory": "Aedric Spear",
    "feature_type": "MORPH_B",
    "name": "Toppling Charge",
    "parent_feature": "PLAYER_CLASS_TEMP_AEDRIC_007",
    "class_restriction": "Templar",
    "unlock_method": "Focused Charge rank 4",
    "resource_type": "Magicka",
    "resource_cost": 3240,
    "cast_time": "Instant",
    "target_type": "Enemy",
    "range_m": 22,
    "radius_m": null,
    "duration_sec": null,
    "cooldown_sec": null,
    "base_effect": "Charge with your divine lance to enemy, dealing Magic Damage and stunning them for 1.5 seconds. Interrupts the target if casting and sets them off balance.",
    "scaling_stat": "Spell Damage",
    "max_ranks": 4,
    "rank_progression": "Increases damage per rank",
    "buff_debuff_granted": "Stun|Off Balance",
    "synergy": null,
    "tags": "damage|single-target|gap-closer|interrupt|stun|cc",
    "dlc_required": "Base Game",
    "patch_updated": "U48",
    "source_url": "https://uesp.net/wiki/Online:Toppling_Charge"
  },
  {
    "feature_id": "PLAYER_CLASS_TEMP_AEDRIC_010",
    "system": "PLAYER",
    "category": "Class",
    "subcategory": "Aedric Spear",
    "feature_type": "ACTIVE",
    "name": "Spear Shards",
    "parent_feature": null,
    "class_restriction": "Templar",
    "unlock_method": "Aedric Spear rank 30",
    "resource_type": "Magicka",
    "resource_cost": 2970,